{
  "schema_version": "starlight.team_runtime_plan.v2",
  "team_id": "starlight-platform-team",
  "source_profile": {
    "repository": "frankxai/starlight-swarm",
    "commit_sha": "f7aa7f8cefd2c42bf91c97de89fcb09fcae8621c",
    "path": "runtime/examples/starlight-platform-team.b12e904.profile.json",
    "schema_version": "starlight.team_profile.v2",
    "version": "2.0.0",
    "review_date": "2026-08-10",
    "sha256": "d71aebdba947cad6db2a8b8295eead2a6896d54b99de5ba619cb6dd2876a6baa"
  },
  "generated_at": "2026-10-23T04:04:16.396Z",
  "activation_status": "planned-human-approval-required",
  "authority": {
    "mission": "per-workflow",
    "model_policy": "queen-model-policy",
    "observability": "langfuse",
    "integration": "n8n",
    "operator": "hermes"
  },
  "routing_policy": {
    "policy_id": "queen-workflow-policy-v2",
    "policy_digest_sha256": "3174271b2bb3964eb2e36d2bc7ec230aa1b6ed4b6c3e92523e086cc5af20c3c8",
    "eve_allowlisted_workload_ids": [],
    "allowed_runtimes": [
      "cloudflare-workflows",
      "vercel-workflow",
      "railway-worker",
      "hermes-local",
      "n8n-integration"
    ]
  },
  "workflow_ownership": [
    {
      "workflow_id": "creator-engineering",
      "workload_scope": "agent-centric",
      "identity_state_owner": "cloudflare",
      "durable_engine": "cloudflare-workflows"
    }
  ],
  "human_gate_actions": [
    "production_high_risk",
    "dns_change",
    "secret_change",
    "billing_change",
    "spend",
    "data_migration",
    "destructive",
    "external_send",
    "legal_ip",
    "brand_identity",
    "permission_change"
  ],
  "budget": {
    "policy_id": "starlight-platform-pilot-budget-v1",
    "max_daily_cost_usd": 25,
    "planned_daily_cost_usd": 19
  },
  "lanes": [
    {
      "id": "operator-intelligence",
      "role_id": "coordinator",
      "workflow_id": "creator-engineering",
      "workload_contract": {
        "workload_class": "interactive-specialist",
        "interaction": "realtime",
        "durability": "session",
        "approval_waits": false,
        "code_execution": false,
        "third_party_connections": true,
        "local_private_data": false,
        "always_available": true,
        "risk": "low"
      },
      "runtime": "cloudflare-workflows",
      "mission_authority": "cloudflare-workflows",
      "provider_route": "vercel-ai-gateway",
      "model_route": "balanced",
      "budget": {
        "daily_token_cap": 120000,
        "daily_cost_cap_usd": 4
      },
      "mode": "dry-run",
      "independent_verifier": false,
      "reason_codes": [
        "exact-workflow-owner",
        "bound-workload-executor"
      ],
      "warnings": [
        "Plans and compiler receipts do not authorize workflow start or executor grants."
      ]
    },
    {
      "id": "durable-builder",
      "role_id": "backend-data-engineer",
      "workflow_id": "creator-engineering",
      "workload_contract": {
        "workload_class": "durable-mission",
        "interaction": "async",
        "durability": "checkpointed",
        "approval_waits": true,
        "code_execution": true,
        "third_party_connections": false,
        "local_private_data": false,
        "always_available": true,
        "risk": "high"
      },
      "runtime": "railway-worker",
      "mission_authority": "cloudflare-workflows",
      "provider_route": "vercel-ai-gateway",
      "model_route": "frontier",
      "budget": {
        "daily_token_cap": 250000,
        "daily_cost_cap_usd": 12
      },
      "mode": "dry-run",
      "independent_verifier": false,
      "reason_codes": [
        "exact-workflow-owner",
        "replaceable-code-executor"
      ],
      "warnings": [
        "Plans and compiler receipts do not authorize workflow start or executor grants."
      ]
    },
    {
      "id": "independent-verifier",
      "role_id": "qa-release-sre-verifier",
      "workflow_id": "creator-engineering",
      "workload_contract": {
        "workload_class": "scheduled-intelligence",
        "interaction": "scheduled",
        "durability": "run-receipt",
        "approval_waits": false,
        "code_execution": false,
        "third_party_connections": false,
        "local_private_data": true,
        "always_available": false,
        "risk": "medium"
      },
      "runtime": "hermes-local",
      "mission_authority": "cloudflare-workflows",
      "provider_route": "hermes-profile",
      "model_route": "checker-independent",
      "budget": {
        "daily_token_cap": 80000,
        "daily_cost_cap_usd": 3
      },
      "mode": "dry-run",
      "independent_verifier": true,
      "reason_codes": [
        "exact-workflow-owner",
        "bound-workload-executor"
      ],
      "warnings": [
        "Plans and compiler receipts do not authorize workflow start or executor grants."
      ]
    }
  ]
}
